Text,Label
about 2 weeks ago i told my parents about my anxiety. i thought i'd let you guys know i am getting help from my therapist for the first time today. wish me luck!,Anxiety
"this seems to happen to me a lot. i was blessed with a kick ass immune system, but i'm always freaking out about getting sick, especially before a big event. i have prom on thursday and i've felt shitty since sunday from what i think are nerves. my symptoms are: -weak body (hard to describe) -lower back stiffness -nausea (but in my throat, not stomach if that makes any sense at all) -overall not feeling well but can't really describe the feeling. but it feels absolutely awful like i might as well have the flu or something -throat tightness -rushes where i feel like i'll throw up but never do (i'm severely emetephobic and have only thrown up 3/4 times in my 18 years on this planet, all of them &gt;5 years ago.) -not feeling comfortable unless i'm in my bed or in the bath -difficulty sleeping -feeling like i have a fever but i don't -tense legs -feeling helpless and like if i were to get sick no one could help me i think i have allergies right now but i'm so worried that it's a cold. i'm also scared i'll throw up either now or before prom or i'll feel sick for prom and have my day ruined. is it really possible that how i feel physically is really just all in my head and due to anxiety?? does anyone else get this? how can i stop it?",Anxiety
"every morning since classes started up again, i wake up, and after a few seconds, the nausea sets in. it almost feels like a miniature panic attack. i really hate it, it messes up the rest of my day :(",Anxiety
"i have been getting more and more panic attacks recently and my mum thinks i fake them to be dramatic and get attention. i was having a pretty huge one and she hit me over the head twice quite hard whilst calling me pathetic which obviously just made it worse. shes been hitting me since i can remember. she doesnt beat me on the regular just when ive really annoyed her which makes me hesitant to tell anyone. today i told my grandma what she did and she completely took my mums side saying ""sometimes a slap helps you snap out of it"" i couldnt be more angry as this entire conversation arose because they were talking about how to deal with my little sisters anxiety which is apparently all my fault. yeah the double standards when being a middle child are great... i dont know what to do ive been gaslighted my entire life not to mention my stepdad is a police officer. ive got no family members who will support me but i cant go one like this. my mum needs to know what she is doing is wrong.",Anxiety
"holy schnikes. i feel like a new man. i've been working non-stop for the past 2 weeks. today at lunch, i got so anxious that i went to the restroom and had a ""mini"" panic attack for 5 minutes. i felt so anxious all day. tonight, i hit the treadmill for 30 minutes, walking fast and jogging for a minute or two. i feel like a new man. it totally dialed down my anxiety. if you're not doing cardio, try it. it may change your life. **update: 17 hours later and i still feel great.",Anxiety
"i have a few things bothering me a lot at the moment and very much need some serious advice. when i was 4/5, i was sitting on my dad's lap helping him steer a car into the back yard, i suddenly felt something hard against my backside, he then asked if i could feel it, and i said yes, we then got out of the car. my mum then asks why he had an erection, he tells mum that i was sitting on his lap. she then starts to get jealous and asks what was wrong with her, and they have a small argument before she walks inside, leaving me alone with him. he then asks me to come towards him, with a very deivant expression, i suddenly felt anxious, and say no before running inside and going to my bedroom. he then follows me inside, and enters my bedroom. my mum and myself yell at him to leave me alone, him and mum have another small argument before he drives off. mum then comes into my bedroom later to tell me not to tell anyone about what happened, because people will come to take me away. then, when i was about 11/12 he would enter the bathroom while i was showering everyday, even though i expressed to him that i wanted my privacy many times. i asked him to stop, i asked my mum to talk to him. the bathroom door would be closed (no lock), but he would still come in. his reasons for entering would change, sometimes it was to wash his hands, to check his face in the mirror (which was located directly in front of the mirror), or to just have a chat because he hadn't seen me all day. i would complain to my mum everyday, and she would just say she would talk to him, or even said that i always showered while he was home so i must want him to look at me. these memories have been causing me a great deal of stress, but i'm confused about if they're serious, and if i should be worried about them? i have two young daughters myself now, and i'm worried about their safety around my parents. am i overreacting or do i have something to worry about?",Anxiety
i know it’s hard to talk about feelings and especially anxiety. i myself suffer as well and found it helpful to talk to others and build a support system. no one should have to deal with it on their own and know there are people out there to help.,Anxiety
"i constantly feel like i’m being lied to. i overanalyze things, my brain always finds a way to twisted things people say so it seems like a lie. my head hurts and i often cry. things started to feel like this since i was being cheated on 6 years ago.",Anxiety
"so in my bigger lecture classes, i generally keep to myself and the classes are so big that it doesn't make much of a difference. smaller classes i would stress out a lot more about it but in bigger classes, i just have my misophonia to worry about. but yesterday, my class got moved and i was walking into the building to look for is and saw another girl heading in the same direction, so i asked if she was heading to the same place and she said yes, so i walked with her. we walked in silence for a little bit, then i finally worked up the courage to try and start a conversation with her by asking what her major is. and somehow, we got to talking for the full 20 minutes before class starts! i've never had such a lovely conversation with a stranger so easily, and we connected on a lot of things. i don't know if i'll ever see her again because the class is so big, but i was just happy to have someone to talk to and this has never happened before.",Anxiety
"j. cole is in denver and i couldn't find anyone to go with. i uselessing love j cole and i'm sick of relying on other ppl to do and see the shit i want. so useless it, i bought a ticket and am going solo. i know my anxiety and self awareness will come up but i think once the show starts i'll be too indulged to care. wish me luck :p",Anxiety
"whenever there is a change of plans, i almost always feel an extreme punch to my gut. i typically end up making it worse by immediately jumping to saying i don’t want to do the plans anymore or getting upset with the person. it’s especially hard in my relationship. even if i’d be perfectly fine with having the night to myself, if it’s the same day change in plans i feel like i can’t breath or i need to scream. jumping outside my bubble, i know i’ll enjoy my time alone but my mind immediately goes to feelings of rejection, extreme anxiety, and the need to close off immediately. i just want to jump in a hole forever and find myself in a major low for the rest of the day. this leads to even more disconnect with my partner. in the moment, i feel like pinching myself or really biting my inner cheek. someway to get out the anxiety. have you all found a way to 1. get that anxiety out immediately 2. not hurt your partner with words said/finding peace in a new change of plans. any advice at all would really really help. i’m having a really tough time.",Anxiety
"the older i get, the worse i seem to be at, i don't know, functioning in general. i used to be really sociable, have plenty of friends, i did well in school, had hobbies and interests - i was weird, but enough people liked me that i didn't think about it. after high school it was like the blinders were taken off and i started to see all these things about myself that i really, really hated. i started struggling a lot in social situations, i flunked out of a really good university, i couldn't hold a job, i gradually lost contact with my friends... i was a mess. but i got back up. it was a little harder than before but i still had enough momentum to keep going. i moved back to my old school's city after a semester away, ready to do what i had to in order to re-enroll, but things got worse. i had a *lot* of anxiety already, and you know how people are - they pick up on that. i reconnected with my friends for a little while but then they all ghosted me because i was starting to act a little crazy. i got very depressed and almost did something irreparably bad to myself. so back with mom and dad. again. starting at another school. again. i got overwhelmed and started having panic attacks before classes and pulled out. i got a job and worked full time, but i was not good at it, my co-workers didn't like me much, and i was fired after a year. so i'm back in school yay. except i'm only in two classes and still struggling. everything is just... *so hard* and it's exhausting and frustrating and humiliating. i had high hopes for myself, but i don't see how to salvage any of that from what i've let myself become. i think a big part of my problems is that i'm so used to trying and failing that i'm afraid that's the only outcome if i try again. i look at myself and think ""i've given up,"" because i have. i don't want to! but i don't know how to make life work for me anymore. i don't know how to connect with people. i go out somewhere and it's impossible to think or talk clearly through the static in my head that makes me nauseous and stutter and my heart pound. what kind of a life is one where you can't even talk to someone without turning into an idiot or crying after? i can't function like this. i'll never be able to work like this. has anyone overcome a similar situation?",Anxiety
"i (26 m) am by no means saying that i still don’t feel anxious now and then but i have definitely regained control of my life. i am now living the life that i want to live. no longer is anxiety holding me back from doing anything in life i want to. i am going to try my best to list of a few key points that helped me get to where i am today i no for a fact that i am going to miss out a lot of information just for the fact that it has took a shit ton of little things to get me to where i am. taking time to heal: 1 year ago i made the hard decision to take a break from my toxic job to focus on my own health, this was a super hard decision to make but it enabled me to take the time i need to push myself out of my comfort zone and focus on myself. consistently exercising and eating better: i had no self confidence and was always exhausted so i used to eat junk food most nights just because i felt like shit and the food made me feel worse, now i eat much cleaner, no caffeine alcohol or sugary drinks stopped smoking especially cannabis, i still treat myself of a weekend to what ever i want but for the most part i plan my meals in advance and make sure i eat them throughout the week. and the benefits of exercise are well documented but could not be underestimated. sleep: this was harder than you might think for me and i massively underestimated its value, i have never been a good sleeper usually getting anywhere from 2/5 hours sleep a night was not uncommon, but after a lot of self experimenting what works best for me i have finally got it under control i am now getting between 7/8 hours a night and the difference is chalk and cheese, when you wake up refreshed from a nights sleep there is no better feeling. took a break from ‘soical media’: i deleted all social media accounts (except reddit) and to be honest i have not got them back and i don’t think i will, people portray an image of themselves to the world that they want them to see not their real selves, and it can make you compare yourself to other people which in my opinion is not healthy, focus on yourself. perseverance: not everything you try is going to succeed, over these 8 years i have tried and failed more timed than i could ever count, but i always try again the next day, small victories are the key, i would push myself every day to do something i was uncomfortable doing, some days i would fail but i would try again until i could complete what i had set out to do then more. take experience and tips and tricks from people who have been there before: there is an old saying i can not remember where i heard it but it goes ‘ no man is your friend, no man is your enemy, every man is your teacher’, and basically my interpretation of it is you can learn from any and everyone, and that is what i did i did my own research and reached out to anyone with knowledge about anxiety and panic attack’s and see what they knew about it that i didn’t. i am not writing this to gloat i am writing this so that if even 1 person out there who thinks there is no way out or that life can never go back to ‘normal’ i am living proof that there is, better days are ahead. i hope anyone reading this might find it usually or insightful and if you have any questions leave them below and i will try my best to answer as best as i can.",Anxiety
"felt horrible when i read the news, with the fears that many have about potential war. although i live in australia, i’m still scared about the outcomes. speaking to my dad, he reassures me this isn’t a global conflict (china and russia, and other major players being unlikely to join the war). nevertheless, i understand even a war between iran and the us wouldn’t impact me definitively but the fear of escalation is still tingling me even after the initial shock. i feel like i felt when i heard about the india/pakistan news a couple months ago. the same feeling of when ww3 was trending on twitter a couple years ago. knowing those have not led to the wars that people perhaps fear-mongered about is some respite from the aftermath of the panic. don’t know if i’m looking for people to tell me it’s alright, telling me the straight truth or telling me a white lie to feel better (what i think my dad does at times, or others in other posts). the rational part of me tells me not to worry about this, as even if it eventuates to my worst fears, i’ll be worrying about it twice. with a pretty important interview in a couple of days, i’m trying to stick that, but not sure how i’ll cope as more news comes out (although i’m making myself keep off it).",Anxiety
"so i am starting to venture out of the house after having a very hard time leaving my 2 floor walkup apartment for almost a year now. tonight i accomplished getting to my favorite bookstore which is just around the corner for the first time since last spring! and guess what? here's what happened: i didn't faint. i didn't die. i didn't let lightheadedness/dizziness/depersonalization and derealization stop me from having a great night out! i got to speak to some friends i haven't seen in months. bought myself some books because i can, and can't wait to read them! and my husband who was with me got me a beautiful dreamcatcher that was hanging in the window that has actual carnelian crystals (one of my faves!) in it! this is after about a year (and more) of intense depression and anxiety. (my best friend had died, parents moved away.) thank goodness for my husband who is my soul mate and best friend! (couldn't have done it without him!) recently, i started pushing myself to get outside more and more every day. today was a major milestone! spoke to people on the street. got myself some gifts. felt like my ""old self"". super freaking refreshing. just wanted to share w y'all that there is hope for us and the world!",Anxiety
"today was a really really good day, i left my house for like 11 hours!!! i got past my anxiety and just smiled through the day. i'm sitting on my couch right now after a long day away from home and i feel so calm and sort of relieved. i feel happy, happy that this day was actually really good. my god i almost never leave my house and when i do my head turns into chaos but today it was just calmness. i'm so so surprised. most of all i'm proud of myself :d i feel great!!!",Anxiety
"1. despite the buffoon serving as the american president, there are other elected officials and higher ups whose voices matter too. despite the words coming out of his mouth, he doesn't have a giant dashboard of buttons he can shoot missiles out of. stop watching so many movies. 2. war is costly. nobody wants it, and all the tough talk is just a big pissing contest. north korea would lose hard despite their big words. 3. civilian deaths are a big no-no for everyone, civilians' voices matter too, especially since many have international business relations. 4. despite what the media and the commenters on r/worldnews say, north korea sucks at launching missiles as a whole. they have failed to target multiple times. 5. look to the past. north korea has previously threatened both guam and hawaii, and is no stranger to threats. worse situations have happened in the past. just to list a few: the cuban missile crisis, the cold war, etc. and yet we are all still here. while the situation isn't a good thing, you and your friends will be fine. carry on with your daily lives.",Anxiety
"this should be a celebratory post but i've spent two days awake, shaking, throwing up or otherwise... i don't know if i can do it but i can't live the hell of staying in our 1 bedroom apartment any longer. i got hired at an oil and vinegar bar, and i really want to work there because i cook a lot and adore olive oil and i buy their products, but they want me to be a hard salesman, pull people in, explain a whole spiel about the chemistry and benefits of oil... and i'm dying inside tonight. the owner seems adamant about good training and told me not to spew bullshit if i didn't know it, cause you could be talking to a chemist and you might sound dumb, and i can't get that off my mind. except when i shopped there i dreaded when the employees bombed me with information. so yeah, i work at 2 tomorrow expecting to not last the 2 week probation period. everything i'm studying just gets lost in my head and i retreat back to my no window bedroom calm down. but i can't lose my car or stay in this house.",Anxiety
"as soon as i'm with a group i'm awkward and quiet. if i tell a story and more than one person is looking at me and listening, i become incredibly anxious. worst of all, my face becomes red as a tomato. it's so annoying. i absolutely dread having lunch with my coworkers but i would be happy to have a friendly, quiet lunch with one other person. in a group, i always end up being the person who talks the least. i wish i could just be a normal, social human. i just dislike being in a group of people, it makes me so uncomfortable.",Anxiety
i'm taking an online class this semester and i emailed the professor on how to start the class and i'm worried to open it because i don't wanna feel stupid... i always feel this way about formal emails/phone calls i don't know what to do..,Anxiety
"i was able to use self talk to help me calm down and realize everything would be ok. it was an extreme panic attack. i was vomitting, dry heaving, shaking, felt like i was losing my mind, and just overall felt like it'd never end. it lasted a good couple of hours but i finally got through to myself and breathed and comforted myself.",Anxiety
"for the second time this year, i finished a major project for work, but instead of feeling relieved, i feel totally wound up. this is the side of anxiety that's so hard to explain to people who've never felt it: there is nothing wrong. nothing that needs to be done immediately. no deadlines. no projects at home. yet here i sit, my heart pounding and my mind haunted by a specter of dread. i try to take my mind off it by playing a computer game. but then i feel like i am putting of work. so i sit down to do work, but then i realize i am between projects. so i go outside to sit and relax. and my mind says, ""what are you just sitting around for?? there's so much to be done!"" my brain never turns off. it just keeps pecking at my sense of calm. don't stop working...you'll fall behind. don't take a break...there's more to do. don't eat out of boredom...you'll get fat. don't start that building project...you won't have time to finish it. people worry about something and say, ""oh, i have such anxiety!"" maybe you are anxious. but you do not have anxiety. anxiety is this unwelcome guest that stays in your bed with you, and follows you to work, and to the movies, and to the gym. and you beg it to go away. and when you think it has, you feel like something is missing...a part of you. and your chest tightens again, and the dread creeps back, and anxiety says, ""jk! i never left. i just wanted you to know how much you need me."" i don't need it. but i have it. and goddamn but how i want to get rid of it...",Anxiety
after having anxiety for as long as i can remember i finally started opening up about how i was feeling and got to a doctor. it's been one year on antidepressants and i feel uselessing amazing. they have been life changing. i haven't had a panic attack in a long time and i feel like i can finally live my life how i want to. yes i still have some anxiety here and there but useless has it changed. instead of feeling like i'm dying everytime i'm anxious and feeling like the whole world is against me i feel like i can manage it and over come it. just a happy story for ya. hope it gives you some motivation to get the help you deserve.,Anxiety
for tge first time in my life i phisically approached a woman and asked her if she wanted to go on a date. she said no. but i asked :d me: 1 anxiety: {infinite},Anxiety
"everything has become too much and my panic disorder and health problems are making it impossible for me to work. i'm so scared of telling my boss. i'm so sick to my stomach, but i have to do this. i've been missing so much work and been so sick. i'm supposed to do this in about 45 minutes and i feel like my stomach is going to explode. please send good vibes my way. this is not a choice i'm making lightly or without support or discussion, but it still doesnt make it any less difficult to give up my source of income, even if it's to improve my wellbeing.",Anxiety
"i’ve been working for about 7 months, this is the longest i have held down a job. i’ve gotten a car and started driving for the first time and going places by myself, i’ve made friends and have learned how to talk to people better, i’ve opened my first credit card and started keeping track of bills. i’m still somewhat anxious but have learned to control it better, i’m currently struggling a little bit as a new driver but i’m sure i’ll get the hang of it. i just thought i’d share for anyone who is still struggling. 7 months ago i was completely lost and now i know what’s best for me.",Anxiety
"there was this kid when my husband and i went to see a movie yesterday that would not stop talking. he would talk every 5 minutes about what was happening or what new character came on screen... and i could tell that others around me were annoyed as well. his parents said nothing to him. it took me two hours to mentally prepare myself, but i looked behind me and asked him to please stop talking. he said ""okay, sorry"" and he actually stopped! i'm so proud of myself, usually i'm not confident enough to do something like that.",Anxiety
