Text,Label
"hi. i'm very sorry but i haven't posted here (or anywhere) before. if i break rules or something can you please just disregard this, i don't mean to be rude or inconsiderate or anything. my wife has depression. she has been suffering with it for a few years now. it first hit really hard when she became chronically ill (unrelated to mental health) and her best friends bailed on her for being too much drama. she's had good and rough patches since but tonight has been tough. she sent me this message earlier tonight. ""all my life, i have never been anything other than ordinary. i have never been exceptional in any way. i have never been pretty, or particularly intelligent, or good at sports. i have never been anything over than ordinary. average. i am okay with this. most people really are ordinary. however, i am kind. and generous. i am passionate and considerate and whilst i can be selfish, i am often selfless. i don’t bully or harass others. i vent sometimes about people, but i’m not a gossip, i don’t spread rumours, and i am fiercely loyal. i care about those that i love, and would do anything in my power to protect them. i stand up for what i believe is right. i fight for equality and animal rights. i have plenty of faults. i can be hot-headed at times, but i am almost never unkind. i worry too much and am often incredibly sensitive about things. i am not perfect, and i have made mistakes, but i have never pretended that i haven’t. i have never pretended to be someone i’m not (at least, not since high school). i do not believe i am a bad person. i do not believe that i do bad things or treat others badly. yet all my life i have never been good enough. i’ve had friends, yes, and very good friends. but for the most part, i am hated. i am seriously disliked by so many, and always have been, for reasons i have not and do not understand. i’ve had friends abandon me, time and time again. i’ve been bullied, picked on and ostracised. i was never liked in high school and i frequently overheard my so-called friends say things about me behind my back. i was weird. different. i spoke too much and laughed too loud or i was too quiet and too sad. and nothing has changed. no matter where i go, no matter what i do, no matter who i meet, it’s always the same story. over and over and over again. i am weird. different. unlikable. friends often turn on me, abandoning me for different reasons i am yet to understand. some i never will. and i don’t understand. i really don’t. what is it about me that is so wrong? what do i do that makes people dislike me? what am i missing? do i do something wrong? do i say something wrong? is it the way i act? behave? am i blind to my faults, so much so that i can’t see them? i just want to be liked. i want to have friends. i want to know that the friends i have in my life aren’t going to suddenly abandon me, too. i want to know what is so damn wrong with me that people hate me on such a frequent, regular basis. because this feeling is killing me. and it makes me want to die."" caring for her can be hard but there is nothing more worthwhile that i can do. i'm hoping there is someone on here who can relate with her? if that's you, what do you wish someone had said to you? thank you",Depression
"i didn't have any friends coming over, most weren't even replying to my text messages, my family and i are in a bad spot right now. i haven't really celebrated a birthday for the past six years, even since grade five, i always just sorta... sat in my basement. and watched youtube. and played video games. like i do most days. but today, i am seventeen. and, goddammit, i will celebrate it this time around. so i went on a walk around the city. i got myself a cupcake from a local cupcake shop (i literally haven't been there in years! i was probably thirteen last time i was there, and they make such good cupcakes, like how the useless?) and i decided to visit our local art museum and one of those fancy pay-to-visit gardens. i've always wanted to go, but i never really found the motivation. and, yeah, i had to come home after a few hours and study for my math test, but i really enjoyed myself. i haven't had a day where i just said ""useless it"" and got up and did what i wanted for a day. it was really nice.",Depression
"i really let it get out of hand this time folks. i got an email today saying i’m being excluded from my academics (meaning won’t be able to go to class...) because i didn’t pass 2 of my classes. so now, my choices are 1. talk to the dean to see if i qualify for a cancellation of exclusion, 2. get suspended, or 3. drop out of school. this really pushed me over the edge today. full on mental breakdown, got in my car and almost offed myself for good. the thing is, i know i wasn’t doing too great in the fall and i really was trying to turn it around but it was too late. i promised myself i’d get as in the spring. now i guess i can’t even accomplish my goals. i was already depressed out the wazoo during the school year but now if i have to stay home and find a job i really think it’ll push me to the absolute limit. i’m not sure if i’ll be able to take it. i can’t live with my parents again. my dad doesn’t believe in mental illness whatever that means. thinking about this situation makes me hate everything. im so done with life. i don’t know why i even try anymore. i knew i wasn’t cut out for college and i might as well give up and go waitress again",Depression
"useless you to the people who think just because some of us are strong enough to put on a facade that everything is okay means that we are faking our depression and don't actually have to deal with this mentally debilitating disease. yeah, it is a disease, and no i am not using it as an excuse. i'm sorry just had to rant because those people piss me off so much so that i don't even bother explaining to them how i am feeling.",Depression
"i am a horrible friend. i have a lot of trouble controlling my mood and when things are bad i'm cranky. i get mad over trivial things because....idk...maybe it's easier to be like that then admit how much everything hurts for no uselessing reason. i also vary between very needy and extremely avoidant. i'm super flaky with plans, but i get really upset when other people are like me. i uselessing hate myself. no wonder i'm lonely. no one should have to deal with me.",Depression
"i'm 33, and have been dealing with this beast since about 17. &amp;nbsp; i managed, got through school, went to a university and graduated with a bachelors in economics, from a uc school (university of california). have had a few relationships, decent number of friends, etc. &amp;nbsp; currently i'm working at a warehouse making a pittance and living with my elderly parents. for the past years (many) i've seen my peers become successful, establish families, get married; all the typical shit i guess you would expect with someone when they reach 30+. &amp;nbsp; i feel that i have a high degree of intelligence (i could be wrong), shit, maybe i have aspergers or autism or some shit. anyways...it's like i know where i want to be and i know the necessary steps to take in order to get to where i want to be but i'm incapable of following that path? &amp;nbsp; what i really want to know (and hope to open up a discussion about) is the people that are in their late 20's, early 30's, and beyond that are still coping with depression. what medications have you tried, what is your plan? &amp;nbsp; (more background)...most of the time i feel completely apathetic. most nights, since as long as i can remember, i've wished that i wouldn't wake up the next day. i have a very bleak view of humanity and the direction that we're going in. more recently i've debated with myself the purpose of life. ultimately the purpose of a species is to procreate, procreate, adapt, procreate.... if i have no desire to have children then what is the point of my existence? the point is to find happiness and fulfillment and blah blah and i get that...but let's say your brain is miss-wired (depressed) the majority of the time and there's only fleeting moments of happiness then what is the rationality in continuing on? &amp;nbsp; i'm obviously a cynic, but reasonably so i feel. anyways, i want to change, i want to be happy and have some purpose in my life. i want to hear from the older crowd about what they're doing /have done to make life more purposeful. &amp;nbsp; sorry for the rant, i'm just getting at the end of the rope and am beginning to contemplate the end; my precariously unleveled existence...",Depression
"oh you don’t like the way you look? here’s the prison door key for that: stop uselessing eating garbage and actually go everyday to the gym you pay $40 a month for.. oh you have no social life? here’s the prison door key for that: join some meetup groups, volunteer, take a creative class, check out that unitarian church, put an ad out on craigslist to find people to play music with oh your lonely? it’d be nice to date? here’s the prison door key for that: use key number one, and then put up some profiles and join some sites.. oh you think you could give trent reznor a run for his money and you’d love to actually create the musical ideas that have been floating around in your head for over a decade? here’s the prison door key for that: take the multiple thousands of dollars worth of musical gear out of their boxes, set them up, watch the uselessing tutorials, join forums ask questions, pay someone to come over and explain shit if need be.. but you just keep sitting in your jail cell knowing you have the keys.. weeks turn into months that turn into years .. sitting in misery while dreaming of what life would be like if you could just use the keys you hold in your own hands.. constantly aware of the infuriating absurdity of your predicament..",Depression
"i'm sorry for my incoherent rambling. i just wanted to get this all off my chest. i never imagined i'd really want to off myself at 24, but here i am. i'm constantly stressed, crying, and pining for a new life. i realized that i wasn't really living so it shouldn't make much of a difference either way. i've been prone to depression for my whole life, but i've found it manageable when i exercise regularly and surround myself with positive people. almost 2 years ago, i started working at a call center as a broker. the kind of emotional abuse i experience from upper management and customers is something that has been deteriorating my mental health. i used to believe that most people are inherently good, but i don't anymore. i would give anything just to not cry all the time. that's all i want.",Depression
"i'm pretty sure it's the only thing that's keeping me alive, maybe not alive, but wanting to occasionally live. it's an escape, whether playing or listening. i'm glad i have it, but it's also scary to be so reliant on it. i do recordings and write songs, i guess it gives me a sort of purpose. if i do leave, i'll have something that people can look at and listen to as a reminder that i was maybe okay at something in my life.",Depression
"you know, that endless commentary telling you how awful you are, or how you're screwing up, or how you keep making the same mistakes? that inner fountain of negativity and despair? or is it just me? i think it's a common experience, but it's hard to know when surrounded by people who aren't openly struggling with anything in particular. i've also been told mine is very mean. there are many expletives and much name-calling is done. what's yours like?",Depression
"i'm trying to keep busy, this july 4th weekend, by painting, but i can't focus. i keep thinking about how everyone is having so much fun, and here i am, as lonely as ever. i didn't feel this shitty since last thanksgiving and christmas :(",Depression
"apparently it's not normal to immediately self flagellate yourself for even the most minor of offenses apparently it's not normal to treat yourself like you are worth nothing, and to think the very same apparently it's not normal to distrust any good intentions and to dismiss any well meant compliments apparently it's not normal to observe your reflection and harshly criticize the sloppy construction of your face apparently it's not normal to assume everyone you have ever met despises your existence and everyone you ever meet will do the same apparently it's not normal to replay awful memories of you being a terrible human being and consider that you're still that horrible person today apparently it's not normal to reject any form of kindness towards yourself because you know you don't deserve it apparently it's not normal to want to die who'd've thought, huh",Depression
"you want certian people to always be there for you but they just can't be. they're busy and have their own lives. or maybe they just don't understand how much you're going through, or maybe they don't care too much. i don't know. i get really attached to people at times and constantly wish to be around them and talk to them. i just wish i had a best friend i guess. someone who constantly checked up on me and actually maybe showed concern for my well being. i just want to spend time with someone my age who actually also wants to hangout with me, and not just me wanting to hangout with them.",Depression
"i've had depression for a little over 10 years. gone through many meds, many therapists, many life changes, and many habits. i have an arsenal of things i know help my depression from personal experience: talking a scenic walk outside, eating well, exercising (cardio, weightlifting, yoga), going to social events to mingle with new people, keeping in touch and hanging out with old friends, maintaining good relationships with family, actively learning or employed regularly, volunteering, cutting back on tv/games to only a few hours a day, meditating, reading a book about philosophy/psychology/self help, taking meds, seeing a therapist i rattled off 13 things there. i've never done all of them at once in my life. right now i have 6, maybe 7, decently covered. i've been at 0 or very low single digits countless times. the rest are things i feel like i can't put enough effort into. hopefully, getting medicated for depression again will help change this. it's just frustrating that i know what i have to do yet my mood makes to so hard for me to actually do basic, easy things to keep myself happy. it's like having a map to a new vacation spot where you'll be finally satisfied. but your car is almost always broken down for some reason. so to get there you have to manually tow it for mile in the mud. and you see the other cars effortlessly whizzing by you and you just want to go back home and quit.",Depression
"i came home from work and my husband had moved out. we had been together for more than 15 years. no desire to discuss what went wrong, no chance of reconciliation, no warning... he was just gone. i’ve had mdd for 9 years following a traumatic brain injury. now i’m in the deepest depression i can imagine. i’ve been hospitalized. i’ve been thru 7 weeks of outpatient. i can barely get myself out of bed. i feel so alone. the worst thing that i’ve ever been thru and the one person who was my best friend in these times is gone. i also self harm and had been clean since hospitalization and just relapsed. each day is longer than the last. my therapist says it’s like a heavy fog and that slowly it will dissipate until one day i just look around and realize i can see clearly again. i make myself do something productive every single day. but it never feels like enough and i have so much guilt for not being able to make myself do more. i also wonder how long until everything physically starts falling apart around me because i’m not functioning and i’m alone in this house. i try to keep it clean. i care for my pets. i try to talk to someone every day so i’m not completely isolated. i’m working part time again and slugging thru it. it’s torture. i just needed to share this with someone other than my journal. the struggle to just survive is so painful.",Depression
"latest update; if the majority wants me to go into detail in everything of my experience from that night on, the other side and such. id be happy to, i need motivation and comfort to do so. well ive never been on this website. i just googled my thoughts thorough and sorta winded up here. 29 hours ago i ate 30 tablets which of brand i will not state due to security, i drank 10liters of beer, one bowl of hash and said bye. i met my childhood friend, he said i was more than welcome, he missed me, we'd have fun. i instantly thought i was trippin on some sort of marked dope. my long lost friend told me about times i forgot by far, in details, things that i miss. i felt like i was hanging out with him for weeks, when suddenly i saw an old woman which i clearly knew (not going further into details but she is well known by our family as a psychic). she told me to say loudly if i was happy at the moment, which i did. we sat and spoke for what felt like a few hours, about everything. lastly she asked me if i wanted to be happy or feel blank. what's the point of the blank familiar feeling? i said life is blank, you always without exception fill the blanks. in a rush so badly, i coughed blood on my floor leaving trails all the way up to the bathroom. i was not gonna leave, i was on the other side, it's nothing but the blanks you cannot fill inn because it's too late. so later on, i woke up on the er. i felt alone earlier, i wish i was alone when i woke up, but i got huge amounts of love. gonna fill in thread as soon as i recover more, i made a promise to a long lost friend to remember it all. -cpa -2018 closing up, j-6d today - 12/23/17 hello friends, i cant even start to express my graditude and support towards this whole situation. cpa is the wing of the hospital im in for the moment. 2018 is comming to us fast, the last thing i can remember thinking is ""this year is closing up, getting dark and done"" ""j-6d"" - jail for 6 days, not literally but my mind is set somewhere so far from myself i see the rehabilitatin process being some sort of prison. again id like to thank you all, the support on the all new site for me is immense and id never see such an amount of it. keep in mind that english is not my first language, i just see patterns in my head to how it should sound due to my autism. lets start again, i've already fallen back twice. adrenaline popped somewhere in my shoulder to get me back last time, not due to the fact id wanna die. but i've gotten severe damage from the attempt which the doctor said would make life ""different"" for now im doing okay, im tired. really really tired. i feel empty and for the moment completely alone. doc put on donnie darko today, i watched the whole thing thinking about depression and family for some reason. i've seen it a gazillion times but that's the first step to ""different"" i guess, im not familiar with the feelings i got at the moment and im gonna keep posting daily (as far as my body and mind lets me). for the moment i can barely do it, fyi i would never even start typing on here today if it wasn't for all the support and heroism in mankind. you are all my glowing angels, thank you. -xx dxty 3m",Depression
"i absolutely hate this statement. the thing is, i think you can love someone even if you don't love yourself, and that in itself can be the reason the relationship falls apart. ""why don't you feel good enough? i love you, why isn't that enough? i compliment you all the time. why don't you listen? does my opinion not matter enough?"" it's not that it's not enough. it's that i reject the way you see me because i'm not worth it *in my eyes.* it has nothing to do with what you feel about me, it's just the way i view myself because i've viewed myself negatively for so long, and can't change now. it's too much of a comfort to dislike myself. is that annoying to handle? probably. but, it doesn't change the fact that i can love someone with my whole heart and not feel an ounce of love for myself. can anyone else relate?",Depression
"no special occasion. i just had a tough day at work so i picked up a big bunch of tulips on the way home. not the cheap ones either, but the lovely fresh perfectly blooming crisp and colorful kind. ""what's the big deal?"" you're probably thinking. the big deal is that there was a time in the not so distant past that the thought of ""treating myself"" to anything ""just because"" filled me with guilt, shame and self loathing. you don't deserve it. it's too good for you. you're not worth the time/effort/money. you are nothing and you have nothing to offer so you deserve nothing in return. so now i really appreciate any small act of kindness i afford myself. yes, there are still days that i force myself to have a cold shower in the morning just because i hate it. i love cooking delicious food for other people, but i still sometimes eat instant noodles when i'm alone and having a bad day because it's a waste of time to cook just for me. but today i showed myself a little kindness. i acknowledged the fact that i work damn hard and i am great at my job. i have value and i am valued. tulips are beautiful and so am i. i deserve to have beautiful things in my life because i am a badass bitch.",Depression
"the most popular girl in our entire school here goes around bragging that she's depressed, cuts herself, and wants to die. she doesn't realize that the people who are depressed don't want to scream it to the world. she also says that she's the only person who's actually depressed, her life sucks (her family is rich and loves her), she has no friends, and everyone else who thinks they're depressed is not as miserable as she is. (also, i'm pretty sure she doesn't sh based on the fact that she wears the most revealing outfits possible. the only areas she hasn't shown are the ones that don't show when you wear a bikini.) she says she hates herself while trumpeting how awesome she is because all her teachers like her and she aced that test and she's not fat, et cetera. just needed to vent about this. edit: i tried to talk to her about it and help her, maybe share some of my own experiences. yeah, bad idea. also, she doesn't just tell people, ""hey, i'm depressed"". she makes jokes about people who want to die. not her, other people. like me.",Depression
"i feel pretty good right now, guys. just a little bit of info, i've been self harming since i was 10. for 7 years i've never worn short sleeves outside because i was afraid that someone would find out or judge me because of it. today, i'm finally ending this cycle of self harm. i've kept myself clean and resisted urges for 2 years, waiting for the day i could finally replace the scars with something i love: books. specifically, a literary tattoo! here's a comparison photo (warning: may be triggering, contains scar photos): it's only half done, but i felt like sharing anyway! the lightbulb is inspired by anthem by ayn rand, the moth by the death of the moth by virginia woolf, and some nice green roses to represent oscar wilde. all represents individuality, finality, and pride in being ""different"". these works and people kept me alive through the years. thanks for listening. i don't post often, only when i feel really, really bad. this time i'm glad to be posting something good. :) edit: here's a proper look at the tattoo:",Depression
"i miss the freedom and carefree aspect of my youth and i crave it, often daydreaming about ‘better times gone by’. (long hot summer holidays, playing outside al day long, watching the stars, first exciting nights out as a teen....) but the reality is that even my childhood &amp; adolescence was marred with depressive and negative thoughts! i’d love to appreciate the present.",Depression
"i do this all the time. if i'm crushing on someone, my mind will usually be filled with a bunch of sappy romantic plot lines, that will never happen in real life lol",Depression
"i have somebody in my life now. a few months ago i posted about having nobody to talk to. well, last week that changed. during school, (hs btw) i was sitting in class doing nothing. deadpan as ever, when this girl in front of me just turns around and start talking to me. i was caught off guard. i haven't had a loose, non structured, conversation with a stranger for a very long time,. a girl even moreso but i talked to her, let my guard down for a minute and really had a good time talking to this stranger. after the class, we parted ways. i was extremely happy. talking to somebody after all this time has really helped wifh my self worth issues. the fact that somebody just talked to me out of the good of their heart is very foreign to me. now, we talk periodically, and i feel human for the first time in a long time. wish me luck, guys.",Depression
"i don't see it being discussed much. it makes me feel rather isolated. i don't think i even remember joy. i only seem to recall fear and deep sadness. i've been depressed since i was 9. i suppose i was genetically predisposed to it as it runs on both sides of the family. a lengthy move across the pond, and the bullying that went with being the new, weird kid at school triggered it. an inferiority complex due to a learning disability only made it spiral uncontrollably. most people my age (i'm turning 18 next month) seem to be so excited about life, but i only feel helpless. i am exhausted at this point in life, and feel like i can barely keep up with the ever so busy and growing world. depression has taken all interests and motivation away from me. i have a rather vapid life with a personality to match. i'd be open to read your experiences and feelings!",Depression
