Text,Label
"couldn't think how to title this. i've got other issues but i'm thinking this one may be tied to my anxiety/panic problems (or maybe it just exacerbates them?) for example, i've noticed it most pointedly the past week while my cat's been sick. she's been to the doctor, i'm handling the practical stuff. but emotionally it's roller coaster. she seems to be feeling better (responding to meds and eating) and my mind's saying yeah, she's back. she seems a lil stiff and not eating as much as the previous days and my mind starts planning her funeral. (rationally i can see she's not acting like a sick cat, you can tell when they're uncomfortable and have given up. plus the vet hasn't done or said anything that seems like they think she's that sick. it's just my scared little mind that won't shut up and stop crying) it's like anything (in general, not just currently with the cat), but any time something isn't perfect, it's the end of the world and i'm positive it'll never get better. so i seem to spend a lot of time worrying about how i'm gonna handle the worst-case scenario which my mind won't stop telling me is definite even though the rational whisper knows i've never yet had to deal with the worst-case scenarios. i'm just wondering if y'all can relate? is this an anxiety/panic related thing? i've got some other issues (diagnosed bipolar and self-suspected mild asperger's) so i'm trying to define/understand what's going on with this catastrophe thinking because i deal with my issues/symptoms best when i understand better where they stem from.",Anxiety
"whenever i'm awake for too long, i get anxiety, even though i have nothing to feel anxious about. like,if i need to stay awake for studying or work in, or, for example,let's say i stayed up all night, and then i want to stay awake during the day to fix my internal clock; (so i won't sleep during the day and stay awake during night again) i get strong anxiety and then i end up needing to sleep before planned. when i force myself to go through it, i end up feeling incredibly unwell (nauseous, low pressure, tachycardia) once or twice before i start having full-on panic attacks. then the crisis keeps going and i have to wait until they pause so i, again against my plans, can go to sleep. it seems there's no way out. i hate this and i wish i could push my body when needed like a normal person. this always happens when i push myself to stay awake and is really annoying, and also, other people don't understand or trust me and end up seeing me as just undisciplined and unable to have self control (just sleeping because i give in too easily or idk). tl;dr: post title",Anxiety
"my doctor and counselor have me listed as extreme anxiety and depression, early childhood ptsd, bi polar, borderline personality disorder. it's a relief to have an answer to what my problems are. this has been an on going problem my whole adult life. my first job, i had reasons for being depressed. i dropped out of school, parents were divorcing and i didn't have a stable housing situation, i was falling behind and depressed, full of anger and anxiety. i didn't want to call myself weak though and admit i had a problem, so i attempted to self medicate by escaping reality. i skateboarded, played video games, drank, smoked weed, partied, did everything i could to feel numb. 5 years later, because i didn't seek help or medication early on, i was put on suicide watch due to my new medications not working properly. i have had a girlfriend for 4 years now, i just play games now and skate, no negative influences in my life. none the less, last month i lost my job, where both my girlfriend and i worked together, and commuted together for 2 hours everyday. we both made pretty decent incomes, my girlfriend is my back bone and structure to things getting better in my life. i can't thank her enough despite me losing my job and making the workplace awkward for her. she helped me apply for disability. she helped me stay in contact with my advocate for whatever questions needed to be answered. we filled out the questionnaire's together and made the best of a shitty situation, we have savings to go off of, luckily we live with her father in a nice location in california rent free, we cover utilities and our phone bill/internet and that's it. well, has and groceries as well, we just do our best on her one income until my sdi gets submitted and approved. i'm currently seeking my residency and gathering needed paperwork for the drivers written test, then i can finish my sdi application. my point to all this is i would be homeless and probably dead without her. she has saved my ass countless times over the years,having a mental illness makes holding a job so uselessing difficult, i've lost at least 6 jobs since being with her. i have nothing but respect and love for her to be putting up with all this, while we are both still fairly young (i'm 24, she's 21 later this year) i wish her parents understood mental illness, but it's kind of a taboo in her family so we keep things as vague as possible. i just hope that i get through to disability services and can make an income that way, to relieve some stress from her life. she put off school for me from the very beginning, the least i can do is help her get through school. sorry about the rant. i hope everyone has a great day.",Anxiety
"yesterday night i had bad mental distress. i couldn't sleep because of anxiety, felt like i was on edge. got only 5 hours of sleep, for my age (14) it's really exhausting. when i woke up my anxiety was flaming again. i am a starter lua scripter, i did some scripting for 30 minutes, and my anxiety disappeared. just amazing how doing something you're passionate about can help. i'm better now.",Anxiety
"for example, my parents are going away for a week later this year. i don't want to be at home alone, but i can't sleep out of my house, i haven't slept out in at least 10 years. i asked a friend if they would mind sleeping over and they were like ""sure! i'd be glad to"". i was like, what, they just agreed like that??? they're so cool with sleeping out???? what???? aren't they going to miss their bed? and pets? and family? so weird to me.",Anxiety
"tomorrow i bury my best friend who tragically passed away at the age of 25. i'm heartbroken and i will be speaking at his funeral. i am happy with the speech but i am nervous, petrified to mess up. he was an incredible guy and i want to send him off well, justify what he meant to me. my ex who broke up with me 2 months ago has kept contact to ask how i have been doing and if i ever needed anything go to her. i went to the gym yesterday evening just to pass the time and maybe work off a small hangover i was nursing from the night before. i felt okay but by the end of my session i was very tired. as i was walking back towards my flat i spot my ex with a guy next to her sitting down. i could have turned around but i didn't. i go up to her and say hi, she seems shocked to see me and asks if i'm doing okay. i say no, not really and say i'll leave them to it and say goodbye. as i walk down the road my ex has caught up with me after she runs to catch up with me. she says she has done this to tell me that what's happening with her and him is not what it seems and she didn't want me to worry about something when it's not. she says they are not seeing each other and that he is just a work friend. that he is going through a hard time. we then get talking about how i'm feeling, how devestated i am, how i'm scared for wednesday. she and a mutual friend went to a concert last week and she mentions they talked. she said she went on a rant about how much she cares about me, that i was her best friend, that she is worried for me. she says she's nearly messaged me just to see if i want to hang out. she has come to me since my best friends death to apologise and she says that she will leave me alone now and will wait for me to message. i do say i miss her but right now my head is all over the place. i'm considering my options about going home and starting again. that i'm not looking for anyone right now. i'm just tired, exhausted. she said i look like i haven't eaten well, that i'm really pale. she nearly went to the same club as me the night before but didn't and stays she's glad she didn't. she offers to cook me a meal or go for coffee. that she is always here for me. i ask again about them and she says they're not seeing other, that something could happen but it isn't. i accidentally saw her open diary just before the break up about a guy who has a family that makes her laugh, feel alive. this guy has a child. i recognise him from her xmas party. i'm really confused about why she chased after me. it's obvious she cares but is she feeling guilty, trying to spare my feelings in the hardest time of my life. i do want her back in my life but seeing her with another guy hurt big time. seeing them close to each other eating ice cream. she works with him, did she like him when we were dating. i also hate the idea of her sharing her sympathy and support with other people, especially a guy like that. and it hurts to hear her say to me he's going through a hard time. i'm going through the hardest time of my life. i feel like i can't use her as a crutch. i'm so confused, hurt, a mess. i bury my best friend tomorrow . i am absolutely terrified. i feel sick, like i'm going to mess up and ruin everything. the last 2 months has been the worst of my life, it just has. i want things to be better. i want him back. i want her back. i feel terrible.",Anxiety
"im suffering from serious trauma from my past. my father beat me and molested me. he also kissed me on the lips and demeaned me treating me like a girl. every time he looked at me, itd make me feel belittled and raped. my housemate has the same insecure belittling qualities my father has. i was also beaten and emotionally manipulated by an abusive mother who beat me with a stick, only yelled and never spoke, used me to polish her ego, used me to shame my father, shamed me, embarrassed and belittled me by objectifying me and herself, and buried verbal poison into wounds she'd keep open with her constant psychological insanity. my roommate who sleeps next to me has the same judgmental and psychopathic qualities as she has. i'm trying to ease the trauma i've felt ever since i was first beaten by them at too young of an age to remember by loving myself and hugging pillows while i feel vulnerable, but it's hard. it's really really hard. none of them know who i am. not even the brother i though would be my companion but ended up severely abusing me through-out my entire life. physically, emotionally, verbally, mentally, and sexually abusing me. he'd ""sock me in the face"" every chance he could, pushed me around, step on me, make me suck his dick, make me eat my own shit, call me fat and autistic, and just release his anger any chance he could in any way he could find using me. i need to get away from all this abuse. i want to love myself for who i am and comfort myself and be there for myself and love being me. i want my life back from all the abuse. i want to absolutely own my life. right now i need comfort and love and compassion and empathy for the little boy who was first beaten by his parents and left alone feeling abused and abandoned too young to do anything about it. its okay kyle. im here for you.",Anxiety
"anyone else get anxious about parents dying? i just returned home from vacationing at their house for the holidays and i'm crying like an 8 year old who just got dropped off at camp. my anxiety about this particular issue manifests into very long, depressive crying spells. how do you deal? i live states away from them.",Anxiety
"first day of my classes today, you know they ask each one to introduce themselves. i had a panic attack when it was my turn so i said useless it. i told everyone i have anxiety issues, and that it's really hard for me to speak in front of an audience. i heard some laughs, but i don't know if it was just a surprised laugh. the professor was super nice about it. i feel good about it but also kinda feel vulnerable now that everyone knows about it.",Anxiety
"for so long i hid my anxiety. my panic attacks, my mood swings, my sadness, my fear, my derealization. i thought, real men don't admit weakness. real men don't need to reach out for help bc of a mental condition. real men suck it up and push forward. how wrong i was. you know what real men do? real men take care of their responsibilities, and above and beyond all, your health is your responsibility. there is so much help out there for you and so many ppl willing to help you. lifestyle changes, talk therapy, outreach groups, psychotherapy, medication, journaling, exercise, religion to name a couple. in my darkest hour i told myself that i needed to fix myself on my own or else i was weak, inadequate and a failure. i told nobody about my situation and internalized everything. i can tell you first hand, this gets you nowhere. talk to someone. vent on reddit; message somebody (message me!), try bringing it up to your most trusted friend / family member. find a therapist near you and just send them an email. once you realize that you're not alone, things can became much, much easier.",Anxiety
"i might not be able to help everyone but hopefully one person. i'm in no way an expert and i'm still trying to master the following method. it's all about mindfulness/awareness/living in the moment, that's the answer. why do we get anxious at times? because of our thoughts - thoughts that only exists in our mind. it's almost impossible to be anxious while you're living in the moment without thinking about the past or the future. each time you catch yourself thinking/daydreaming just be aware of it and go back to the present and you'll see what a huge difference this makes. i'm not keeping my mind busy to forget about things, i'm doing my best to keep my mind quiet. at night before i go to sleep, i focus on nothing and i have been sleeping a lot better and i am no longer dealing with morning anxiety, why? because i am not focusing on any thought, i'm letting thoughts come and go. this is seriously as easy as it sounds, try it. for a few hours just let thoughts come and go and just be ""aware"" of that precise moment. before when i used to practice this i always gave up because i thought i was supposed to not think of anything but the key is to just be aware that you're thinking, control the thoughts, don't allow them to control you.",Anxiety
"i just saw a motivational speech tonight. the speech was fine, good advice, well written. but i left it feeling so hopeless and almost in tears. here's this guy who's wealthy, driven, positive, and fit as useless. i'm struggling to work out once a week. i'm struggling with eating issues. i'm gaining weight. i feel like i'm surrounding myself with people who encourage my bad habits. i feel cruel for thinking badly of my only friends. i feel like i'm constantly treading water, just trying to keep my current achievements on par with my previous ones. i feel like a uselessing negative nancy and that by not fixing that *right now,* i'm sabotaging my own life. i don't feel motivated right now. i sort of want to curl up into a ball. does anyone else react this way to motivational speeches?",Anxiety
"i've been convinced i must have heart disease because i can hear/feel a flutter/pounding in pretty much every beat of my heart. it is there pretty much all day everyday to some degree. it's particularly bad when i am resting/sitting in bed. it is better right in the morning and worse after meals and stress. it gets worse whenever i get tension in my forehead which makes me think it is related to stress. i have been to cardiologist and so far ekg/echo/holter has been ok. i cannot stop thinking about it. breathing with my diaphragm tends to help. i know it is probably also related to ocd and being hyperaware of my body. it is really just a hell i cannot escape and it is really motivating me to take serious action to improve my anxiety. i need to learn to relax. anyone experienced anything similar/been able to overcome it?",Anxiety
"i’ve had various forms of anxiety for years, but it’s my anxiety surrounding work that’s giving me the hardest time. i currently work from home as a freelancer (not by choice), and it’s getting harder and harder to keep things in perspective. i get irrationally worried that i’ve made a mistake, and when i do make the inevitable mistake, it feels as if my entire world is falling apart. like i’ve failed in the one thing i still have in my life, and am therefore undeserving of life. outwardly, i can accept criticism gracefully, but on the inside i’m a screaming disaster. i can deal with those feelings. it’s awful and makes me want to vomit until i die, but i’ve somehow managed for years. what’s giving me problems now is what i call “hiding.” i’ve become so afraid of these feelings that i’ve started avoiding working by default. i don’t open emails that have the slightest possibility of criticism. i put off sending emails that might lead to more work. i’ve started avoiding social media because i might see criticism of my work (even though that has literally never happened, and rationally i know it won’t). and with no boss or co-workers to check in on me, i don’t have any impetus to snap out of it. this self-isolation is bad for my mental health (i live alone and have little enough interaction with other humans as it is), and it’s incredibly damaging to my work life. i need advice on how to stop. i’m planning on seeing a therapist as soon as i can afford it—but if i can’t snap out of it first, i won’t ever be able to afford it. has anybody else experienced this? what did/do you do to help?",Anxiety
"i actually went to my first ever university lecture and stuff and it was great. all this worry for nothing! start of a bright future i hope! edit - i've read all replies and comments and it's so nice to feel like i am not alone with this &lt,3 thank you all!",Anxiety
"i've been meaning to apply for a job for over a year now but i never got the guts to do it (even though my family desperately needs the money) because all of the available jobs in my field (translating) were in call centers where i'd have to make dozens of calls per day (and i'm also a full time student). i have pretty bad anxiety and i'm most scared of making a fool out of myself in front of my coworkers/boss/clients.. but yesterday i finally sent in my application and just now i got off the phone with an employee from the company. those were quite the painful 8 minutes and i thought i messed up bc my voice kept trembling and i was sweating bullets but i have an interview!!!! on thursday!!!!!!! (unfortunately it's still in sales so if you have any advice for getting over phone anxiety then please tell me 🥺) my heart is still beating crazy fast but i did it..even if i don't get hired at least i tried my best 😭😭😭😭",Anxiety
"lately i’ve been getting these waves of tiredness i’ll feel throughout the day. i start to feel sleepy and my head gets fuzzy. my sleep has been very shitty for the past couple weeks, i wake up every night around 2 am and stay up for an hour. so that probably has a lot to do with it, along with working 6 ten hour shifts. is this just mental fatigue? is my anxiety also contributing to this?",Anxiety
"have just come of my meds last month after managing to travel the world for a year on my own and then staring my first year at university. years ago i physically couldn’t leave the house for months at a time out of fear, now i am a completely new person. you can beat this, no matter how long it takes.",Anxiety
"i consistently talk to myself. sometimes i will sit down, and have conversations with myself. it's like a back and forth q&amp;a; as my mind wonders off about a curiosity, or uncertainty, i will verbally answer myself, sometimes in great detail. not sure if this is just an inflated ego answering my insecurities, or if this is just normal human behavior. sometimes i compulsively call myself negative names too. like ""idiot"", ""stupid"", or ""loser"". in all honesty, i feel like i only call myself these names to motivate myself to do better next time. however, i'm not sure how helpful it really is.",Anxiety
"around 4 years ago, i went through the worst anxiety i have ever been through. i didn't understand what was wrong with me and thought i was dying. i couldn't be left alone or go outside without going through a panic attack. i would convince myself that every lump i felt was cancerous and make numerous visits to the hospital only for them to send me home after hours of waiting. i was prescribed diazepam/beta blockers and almost prescribed citalopram but i only choose to take 2 diazepam and that was it. during this time i told my mum that i wanted to be sectioned because i believed that i wasn't in control of myself and was unaware that it was my anxiety causing me to think this way. every appointment i attended was also through the help of my mum as i felt like i couldn't go to any of them alone. i received two visits by mental-health specialists, 1 of them believed i should be on medication for life and that i would need to take medication to function and do normal things. the other told me that i should prove him wrong. as time went on i began counselling and attended a group cbt class. at first i felt like nothing had changed and that i had wasted my time but looking back on it now, i feel like everything got put into perspective around that time when i realised that my anxiety is just a part of me and that no matter what discomfort i go through it always ends up going away, i chose to feel the anxiety and not let it affect me doing anything i wanted to do. within the past 2 and a half years i have attended job interviews, bank/doctor appointments and completed a mathematics course. i now do my own food shopping, have a part-time job which is a customer-facing role and i'm in the process of working with a job agency to get a better job. to cut a long story short, i have went from having severe agoraphobia and panic attacks (-4 years ago) to working a part-time job and doing everything for myself. i'll probably delete this post in few hours but i hope it helps somebody on here who feels like their life will never change. i'm also open to any questions, if there are any.",Anxiety
"okay so let me expand a bit on what i'm meaning. basically i go through stages, where i am gripped by my anxiety, where i feel like i need to embody how other people are. by that, i mean i feel like i need to keep changing who i am in order for people to like me. for example, i recently watched a short video on fb taken from a british reality tv show. in it this girl didn't drink alcohol due to personal reasons, so this lead me down a mini anxiety trip of feeling like if i didn't drink people would think i was different and like me. i know this sounds absolutely absurd and it's so wrong to be thinking like that, but i have this constant need to be liked by everyone &amp; i'm also worried that i'll never find who i really am as a person. this then leads me down a whole other path of anxiety riddled thoughts and i end up putting myself in such a hole that i become so unproductive and i hate myself for it. i'm so tired, i want to achieve something in life but i'm literally doing nothing with my life and when i see other people doing stuff, it's like, i should be more like them. i should be motivated and i should be who they are so people like me and make people proud of me. sorry for this vent, i feel like i've gone off on a bit of a tangent at the end there, but i have no one to talk to about these feelings &amp; i wanted to know if it's a common thing or not.",Anxiety
"i feel like i've cried a dozen times since hearing about it, watching parents speak on the news and reading tweets from the kids who went to school there (including some who were horribly killed). for some reason, i'm really affected by things happening to children and young people. i feel so emotional and distraught thinking about what they must have gone through in those moments of the shooting, and how their families now must feel... i'm not sure why it affects me so much. i'm sure like everyone else i strongly believe children should be protected and put first no matter what so things like this are just... so unspeakable. i hope the gun laws in america change for the sake of school children.",Anxiety
"got bad news today but i didnt have a panic attack. ive learned a lot of new techniques in therapy. things might not be ideal in life, more like a nightmare but, i didnt freak out when i otherwise might have. hoping for a weekend of keeping my cool.",Anxiety
"yes. you. the person reading this right now. you're amazing. i'm telling you because you probably don't hear it as much as you deserve to. because you're battling some really tough things that most people won't ever understand. because even though you're doing that, and it's hell, you're still here. i don't know if you realize what a major accomplishment that is, but i'm here to tell you, it's uselessing incredible. you're incredible. keep fighting. keep going. it's going to be okay. i know it doesn't feel like it sometimes (or a lot of the time), but it really will. you're going to have glorious moments of sunshine to make all this rain worth it. those moments are going to see you through the storms. because there will be storms. maybe you're in the storm right now. you'll get through it. because you're strong, stronger than you think you are. you're incredible and strong, and i know you can do it. i have faith in you. i'm here for you. you. are. amazing.",Anxiety
